{
  "$schema": "https://json-schema.org/draft/2020-12/schema",
  "$id": "https://puakiller.example/schemas/rules/catalog.schema.json",
  "title": "PUAKILLER Rule Catalog",
  "description": "Source of truth for the PUA rule registry compiled into both removal scripts. Describes only the DECLARATIVE fields: Dirs and RegPaths are computed at runtime and written back into the hashtable by hosted-removal.ps1:1085-1087, so they are deliberately absent here.",
  "type": "object",
  "additionalProperties": false,
  "required": ["schema_version", "source", "header_comment", "rules", "banner_line", "signers_comment", "bad_signers", "bad_signer_rx_line"],
  "properties": {
    "schema_version": { "type": "string", "pattern": "^\\d+\\.\\d+\\.\\d+$" },
    "extracted_at": { "type": "string", "format": "date-time", "description": "UTC ISO 8601." },
    "source": {
      "type": "object",
      "additionalProperties": false,
      "required": ["script", "commit", "region_start", "region_end"],
      "properties": {
        "script": { "type": "string", "minLength": 1 },
        "commit": { "type": "string", "minLength": 1 },
        "region_start": { "type": "integer", "minimum": 1 },
        "region_end": { "type": "integer", "minimum": 1 }
      }
    },
    "header_comment": { "$ref": "#/$defs/commentBlock" },
    "banner_line": { "type": "string", "minLength": 1 },
    "signers_comment": { "$ref": "#/$defs/commentBlock" },
    "bad_signer_rx_line": { "type": "string", "minLength": 1 },

    "bad_signers": {
      "description": "Code-signing subjects abused almost exclusively by this cluster. A signer match drives Invoke-CertSweep, which deletes whole application roots, so entries must be distinctive shell-company subjects -- never a generically named vendor.",
      "type": "array",
      "minItems": 1,
      "uniqueItems": true,
      "items": { "type": "string", "minLength": 4, "maxLength": 256 }
    },

    "rules": {
      "type": "array",
      "minItems": 1,
      "items": { "$ref": "#/$defs/rule" }
    }
  },

  "$defs": {
    "commentBlock": {
      "description": "Verbatim PowerShell comment lines, re-emitted unchanged by the compiler. These carry the safety rationale for each entry and must survive regeneration.",
      "type": "array",
      "items": { "type": "string" }
    },

    "stringArray": {
      "type": "array",
      "items": { "type": "string", "minLength": 1, "maxLength": 512 }
    },

    "rule": {
      "type": "object",
      "additionalProperties": false,
      "required": ["id", "Name", "Label", "Rx", "Proc", "Pub", "Nw", "Harden"],
      "properties": {
        "id": {
          "description": "Stable slug, independent of Name, so a rename does not orphan provenance.",
          "type": "string",
          "pattern": "^[a-z0-9][a-z0-9-]{1,63}$"
        },
        "lead": { "$ref": "#/$defs/commentBlock" },

        "Name": {
          "description": "Exact install-folder name. Drives an UNCONDITIONAL folder sweep across LOCALAPPDATA, APPDATA, Programs, Start Menu, ProgramFiles(x86) and ProgramData. The most destructive field in the model: a short or generic Name deletes legitimate software. The minimum length is a structural guard, not a style rule -- short vendor folders belong in Aliases, where evidence is required first.",
          "type": "string",
          "minLength": 5,
          "maxLength": 128
        },
        "Label": {
          "description": "Banner / verification display name. Empty string hides the entry, used for a second helper entry of the same product.",
          "type": "string",
          "maxLength": 128
        },
        "Rx": {
          "description": "Case-insensitive regex matched against process paths, Run values, App Paths, COM classes, uninstall entries, tasks, shortcuts, droppers and Temp items. Stored VERBATIM and never regenerated by the compiler: most of these patterns encode hand-written false-positive reasoning.",
          "type": "string",
          "minLength": 1,
          "maxLength": 1024
        },
        "Proc": {
          "description": "Exact process names to kill, without .exe. Never a generic name (node, msiexec, chrome, setup, shift): generic executables are matched by path through Rx instead, which is what keeps legitimate apps alive.",
          "$ref": "#/$defs/stringArray"
        },
        "Pub": {
          "description": "Optional publisher regex for Add/Remove Programs entries, and one of the accepted evidence signals for a guarded alias. Empty string means no publisher is pinned.",
          "type": "string",
          "maxLength": 512
        },
        "Nw": {
          "description": "Also clean NW.js (nw*) Temp directories whose manifest matches Rx.",
          "type": "boolean"
        },
        "Harden": {
          "description": "AppData-relative folders sealed against reinstall under -Harden.",
          "$ref": "#/$defs/stringArray"
        },

        "Aliases": {
          "description": "Additional install-folder names. Unlike Name, an alias folder is removed ONLY when static evidence (matching filename, registered hash, or signer) is found inside it. That asymmetry is what makes short or generic vendor folders such as 'OB' and 'Shift' safe to cover.",
          "$ref": "#/$defs/stringArray"
        },
        "RegNames": {
          "description": "Exact vendor registry key names, removed only when file evidence or a distinctive primary-key hit is present.",
          "$ref": "#/$defs/stringArray"
        },
        "Hashes": {
          "description": "SHA-256 indicators, lowercase 64-hex, checked by STATIC hashing in guarded alias folders and top-level downloaded executables. Never executed. A malformed digest silently disables the alias guard, so the format is enforced rather than trusted.",
          "type": "array",
          "items": { "type": "string", "pattern": "^[0-9a-f]{64}$" }
        },

        "requires_manual_regex": {
          "description": "True when Rx does not reduce to a bare literal. Such patterns are human-authored and must never be machine-regenerated.",
          "type": "boolean"
        },
        "provenance": {
          "description": "Public references cited by the entry's comment block. Mechanically extracted, not interpreted; structuring these per indicator is manual work tracked by needs_provenance_review.",
          "type": "array",
          "items": { "type": "string", "maxLength": 2048 }
        },
        "needs_provenance_review": { "type": "boolean" },
        "rationale": {
          "description": "Optional prose explaining a safety decision (why no Proc is listed, why no Pub is pinned).",
          "type": "string",
          "maxLength": 4096
        }
      },

      "allOf": [
        {
          "description": "An alias is only safe because something else proves the folder belongs to the PUA. With no Hashes, Proc or Pub there is nothing to check, and the guard degrades into an unconditional delete.",
          "if": {
            "properties": { "Aliases": { "type": "array", "minItems": 1 } },
            "required": ["Aliases"]
          },
          "then": {
            "anyOf": [
              { "properties": { "Hashes": { "type": "array", "minItems": 1 } }, "required": ["Hashes"] },
              { "properties": { "Proc": { "type": "array", "minItems": 1 } }, "required": ["Proc"] },
              { "properties": { "Pub": { "type": "string", "minLength": 1 } }, "required": ["Pub"] }
            ]
          }
        }
      ]
    }
  }
}
