{
  "schema_version": "1.0.0",
  "extracted_at": "2026-09-01T19:22:19Z",
  "source": {
    "script": "hosted-removal.ps1",
    "commit": "ff43b48e9622c422b7337198aa2730f1ce084bd9",
    "region_start": 169,
    "region_end": 285
  },
  "header_comment": [
    "# ============================================================================",
    "#  PUA REGISTRY  --  GENERATED BLOCK. Do not edit $Puas or $BadSigners here.",
    "#  The source of truth is rules/catalog.json. Edit that, then run",
    "#      python3 scripts/apply-generated.py --write",
    "#  which rewrites this region in BOTH scripts. CI fails if the two drift apart",
    "#  (scripts/verify-generated.py). Everything downstream -- the sweep, the",
    "#  on-screen banner, the -Harden reinstall blockers and the final verification",
    "#  list -- is still derived from this list, so a catalog entry is all you add.",
    "#",
    "#  Fields:",
    "#    Name   = top-level install-folder name. The folder sweep deletes",
    "#             %LOCALAPPDATA%\\<Name>, %APPDATA%\\<Name>, ...\\Programs\\<Name>,",
    "#             Start-Menu\\<Name>, %ProgramFiles%\\<Name>, %ProgramData%\\<Name>.",
    "#    Label  = display name in the banner/verification ('' = hide it, e.g. a",
    "#             second helper entry for the same product).",
    "#    Rx     = case-insensitive regex matched against process paths, Run",
    "#             values+data, App Paths, COM classes, uninstall entries, tasks,",
    "#             shortcuts, droppers and Temp items.",
    "#    Proc   = exact process names to kill (WITHOUT .exe). Use ONLY distinctive",
    "#             names - never generic ones (node, msiexec, chrome, ...); those are",
    "#             caught by path via Rx so legitimate apps are never touched.",
    "#    Pub    = optional publisher regex for Add/Remove-Programs entries.",
    "#    Nw     = $true to also clean NW.js (nw*) Temp dirs whose manifest matches.",
    "#    Harden = AppData-relative folders to seal against reinstall under -Harden",
    "#             (e.g. 'Local\\Foo','Roaming\\Foo','Local\\Programs\\Foo').",
    "#    Aliases = optional additional install-folder names. Unlike Name, aliases",
    "#             are removed only when a matching filename, hash or signer is",
    "#             found inside, making short/generic vendor folders safe to cover.",
    "#    RegNames = optional exact vendor registry-key names removed only when file",
    "#             or distinctive primary-key evidence for this PUA is present.",
    "#    Hashes = optional SHA-256 indicators checked in guarded alias folders and",
    "#             top-level downloaded executables (static hashing; never execute).",
    "# ============================================================================"
  ],
  "rules": [
    {
      "id": "openbook",
      "lead": [],
      "Name": "OpenBook",
      "Label": "OpenBook",
      "Rx": "(?i)\\bOpenBook\\b",
      "Proc": [
        "OpenBook"
      ],
      "Pub": "",
      "Nw": true,
      "Harden": [
        "Local\\OpenBook",
        "Roaming\\OpenBook"
      ],
      "Aliases": [],
      "RegNames": [],
      "Hashes": [],
      "requires_manual_regex": false,
      "provenance": [],
      "needs_provenance_review": true
    },
    {
      "id": "convertmate",
      "lead": [],
      "Name": "ConvertMate",
      "Label": "ConvertMate",
      "Rx": "(?i)\\bConvertMate\\b",
      "Proc": [
        "ConvertMate"
      ],
      "Pub": "(?i)Amaryllis",
      "Nw": false,
      "Harden": [
        "Local\\ConvertMate"
      ],
      "Aliases": [],
      "RegNames": [],
      "Hashes": [],
      "requires_manual_regex": false,
      "provenance": [],
      "needs_provenance_review": true
    },
    {
      "id": "pdfeditor",
      "lead": [],
      "Name": "PDFEditor",
      "Label": "PDFEditor",
      "Rx": "(?i)\\bPDFEditor\\b",
      "Proc": [
        "PDFEditor"
      ],
      "Pub": "(?i)(AppSuite|Eclipse Media)",
      "Nw": false,
      "Harden": [
        "Local\\PDFEditor",
        "Roaming\\PDFEditor",
        "Local\\Programs\\PDFEditor"
      ],
      "Aliases": [],
      "RegNames": [],
      "Hashes": [],
      "requires_manual_regex": false,
      "provenance": [],
      "needs_provenance_review": true
    },
    {
      "id": "episoftware",
      "lead": [
        "",
        "    # EpiBrowser / EpiStart - Chromium-clone PUA. Vendor folder %LOCALAPPDATA%\\EPISoftware (all-caps EPI); abused cert",
        "    # \"Byte Media Sdn. Bhd.\" (TamperedChef cluster). Verified: todyl.com/blog/epibrowser, pcrisk #32056, file.net, any.run.",
        "    # Detections: Malwarebytes PUP.Optional.EpiBrowser, Sophos \"Epi Browser (PUA)\". Install: EPISoftware\\EpiBrowser\\Application\\<ver>\\",
        "    # (epibrowser.exe, notification_helper.exe); stager Temp\\epibrowser-bin. Reg: HKCU\\Software\\EPISoftware\\{EpiBrowser*,Update*}.",
        "    # Tasks: EpiBrowserUpdate, EpiBrowserStartup. Full SHA256: installer 06b89c8a..c2044, app 2fe2d16e..f88e31.",
        "    # notification_helper.exe is killed by path-match (under EPISoftware), not by generic name."
      ],
      "Name": "EPISoftware",
      "Label": "EpiBrowser",
      "Rx": "(?i)(EPISoftware|EpiBrowser|Epi\\s+Browser|EpiStart)",
      "Proc": [
        "epibrowser",
        "setup.epibrowser"
      ],
      "Pub": "(?i)(EPISoftware|EPI\\s*Software)",
      "Nw": false,
      "Harden": [
        "Local\\EPISoftware",
        "Roaming\\EPISoftware",
        "Local\\Programs\\EPISoftware"
      ],
      "Aliases": [],
      "RegNames": [],
      "Hashes": [],
      "requires_manual_regex": true,
      "provenance": [
        "todyl.com/blog/epibrowser",
        "file.net",
        "pcrisk #32056"
      ],
      "needs_provenance_review": false
    },
    {
      "id": "onestart-ai",
      "lead": [
        "",
        "    # OneStart / OneStart.ai - \"AI browser\" Chromium-clone hijacker; TamperedChef/AppSuite/BaoLoader cluster, same operators as",
        "    # EpiBrowser (Sophos/Truesec; shared C2 mka3e8.com). Signers: OneStart Technologies / Caerus Media / Apollo Technologies (SSL.com).",
        "    # Verified: pcrisk #30436, todyl.com/blog/onestart-ai-browser-deception, any.run, file.net, advanceduninstaller.com.",
        "    # Install: %LOCALAPPDATA%\\OneStart.ai\\OneStart\\{Application\\<ver>,User Data}; also %APPDATA%\\OneStart. Process onestart.exe.",
        "    # Reg: HKCU\\Software\\OneStart.ai; uninstall GUID {31F4B209-D4E1-41E0-A34F-35EFF7117AE8}. Run: OneStartChromium/OneStartBar.",
        "    # Tasks: \"OneStart Chromium/Updater/Maintenance/Cleanup\" + randomized sys_component_health_* Node tasks. Toolbar OneStartBar/DBar.",
        "    # Full SHA256: installer fb64aad2..f86cfd, app 246e8d6a..f7c9c0, MSI d2690d69..4c392a (any.run). Two entries: 'OneStart.ai'",
        "    # clears the Local vendor tree; 'OneStart' (Label hidden) catches %APPDATA%\\OneStart + Programs/Start-Menu folders."
      ],
      "Name": "OneStart.ai",
      "Label": "OneStart",
      "Rx": "(?i)OneStart",
      "Proc": [
        "onestart"
      ],
      "Pub": "(?i)(OneStart\\.ai|OneStart Technologies|Caerus Media)",
      "Nw": false,
      "Harden": [
        "Local\\OneStart.ai",
        "Roaming\\OneStart",
        "Local\\Programs\\OneStart.ai"
      ],
      "Aliases": [],
      "RegNames": [],
      "Hashes": [],
      "requires_manual_regex": false,
      "provenance": [
        "mka3e8.com",
        "SSL.com",
        "todyl.com/blog/onestart-ai-browser-deception",
        "file.net",
        "advanceduninstaller.com",
        "pcrisk #30436"
      ],
      "needs_provenance_review": false
    },
    {
      "id": "onestart",
      "lead": [],
      "Name": "OneStart",
      "Label": "",
      "Rx": "(?i)\\bOneStart\\b",
      "Proc": [],
      "Pub": "",
      "Nw": false,
      "Harden": [],
      "Aliases": [],
      "RegNames": [],
      "Hashes": [],
      "requires_manual_regex": false,
      "provenance": [],
      "needs_provenance_review": true
    },
    {
      "id": "proonestarthub",
      "lead": [
        "",
        "    # ProOneStartHub / ProOneStartPDF - rebranded OneStart distribution (installers proonestarthub.msi / proonestartpdf.msi); same",
        "    # TamperedChef/AppSuite cluster, DROPS onestart.exe - so the runtime process and the OneStart vendor tree are ALREADY covered by",
        "    # the OneStart entries above (onestart.exe in Proc; \"ProOneStartHub\" matches the OneStart-substring Rx). Pushed via Google",
        "    # malvertising from proonestarthub.com (redirect/C2 brightfuturedevpers.org). Tagged adware/advancedinstaller/loader+stealer on",
        "    # any.run / Joe Sandbox (proonestarthub.msi, proonestartpdf.msi). This entry adds a banner label, hardens the branded",
        "    # install/uninstall folder against reinstall, and serves as a regression anchor; it intentionally lists no Proc (the live",
        "    # process is onestart.exe, killed above) and no Pub (signer rotates; the cert sweep + OneStart Pub cover that)."
      ],
      "Name": "ProOneStartHub",
      "Label": "ProOneStartHub",
      "Rx": "(?i)(ProOneStartHub|ProOneStartPDF)",
      "Proc": [],
      "Pub": "",
      "Nw": false,
      "Harden": [
        "Local\\ProOneStartHub",
        "Roaming\\ProOneStartHub",
        "Local\\Programs\\ProOneStartHub"
      ],
      "Aliases": [],
      "RegNames": [],
      "Hashes": [],
      "requires_manual_regex": true,
      "provenance": [
        "proonestarthub.com",
        "brightfuturedevpers.org"
      ],
      "needs_provenance_review": false
    },
    {
      "id": "onebrowser",
      "lead": [
        "",
        "    # OneBrowser - Chromium-based PUA in the TamperedChef-adjacent ecosystem. Palo Alto Unit 42 tracks WORK PRODUCT, INC.",
        "    # as a OneBrowser signer. Installs under %LOCALAPPDATA%\\OB or \\OneBrowser (also %ProgramFiles%\\OB); persistence uses",